{
  "schema_version": 1,
  "canonical_project": "engine",
  "projects": {
    "engine": {
      "platform": "github", "namespace_kind": "user", "namespace": "example",
      "project": "engine", "branch": "main", "role": "engine-owner"
    },
    "consumer": {
      "platform": "gitlab", "namespace_kind": "group", "namespace": "example-group",
      "project": "profile", "branch": "main", "role": "content-source",
      "sync_from": "engine", "clone_url": "https://gitlab.example/example-group/profile.git"
    }
  },
  "artifacts": [{
    "id": "readme", "owner": "engine", "source": "README.md",
    "destinations": [{ "project": "consumer", "path": "README.md" }]
  }]
}
